,Year,Date,Description,FullDate,Country
175,2021,30-Nov,Barbados becomes a republic on its 55th anniversary of independence while remaining a member of the Commonwealth of Nations.,11/30/2021,Barbados
176,2021,9-Dec,"A truck crash in Chiapas, Mexico, kills 55 migrants who were being smuggled in it from Guatemala through Mexico to its border with the United States.",12/09/2021,Mexico
177,2021,December 16 – 18,"Typhoon Rai lashes into Visayas and Mindanao, killing 409 people.",,Philippines
178,2022,January – September,Coups d'état in Burkina Faso.,,Burkina Faso
179,2022,2-Jan,2022 Kazakh unrest.,01/02/2022,Kazakhstan
180,2022,4-Jan,"China, France, Russia, the UK, and the US—all five permanent members of the United Nations Security Council—issue a rare joint statement affirming that ""a nuclear war cannot be won and must never be fought.""[6]",01/04/2022,"China,EUR,Russia,U.K.,U.S."
181,2022,15-Jan,"The Hunga Tonga–Hunga Haʻapai eruption and tsunami is the largest and most powerful volcanic eruption in decades, and the largest explosion ever recorded by modern instruments.",01/15/2022,Tonga
182,2022,February 4 – 20,"The 2022 Winter Olympics are held in Beijing, China, making it the first city ever to host both the Summer Olympics and Winter Olympics.[7]",,China
183,2022,24-Feb,"Russia invades Ukraine, escalating the Russo-Ukrainian War, causing a refugee crisis and tens of thousands of deaths on both sides.",02/24/2022,"Russia,EUR"
184,2022,20-Mar,"WHL0137-LS ""Earendel"" imaged by Hubble Space Telescope, the earliest and most distant known star.",03/20/2022,International
185,2022,March 15 – November 14,Sri Lankan protests.,,Sri Lanka
186,2022,April – November,Pakistani constitutional crisis and attempted assassination of Imran Khan.,,Pakistan
187,2022,14-Apr,Elon Musk purchases Twitter.,04/14/2022,U.S.
188,2022,19-Apr,"Kane Tanaka, the second oldest verified person to have ever lived, dies at the age of 119.",04/19/2022,Japan
189,2022,6-May,Monkeypox outbreak.,05/06/2022,International
190,2022,12-May,"Sagittarius A*, supermassive black hole at Galactic Center, imaged by Event Horizon Telescope.",05/12/2022,International
191,2022,June 12 – September 12,Heat waves in Europe kill tens of thousands.,,EUR
192,2022,22-Jun,Earthquake in Afghanistan.,06/22/2022,Afghanistan
193,2022,30-Jun,Ketanji Brown Jackson becomes the first black woman on the Supreme Court.,06/30/2022,U.S.
194,2022,July – October,United Kingdom government crises,,U.K.
195,2022,July,Oder environmental disaster.,07/01/2022,"Poland,EUR"
196,2022,8-Jul,Assassination of Shinzo Abe.,07/08/2022,Chile
197,2022,11-Jul,"James Webb Space Telescope takes Webb's First Deep Field, oldest and highest resolution image of the universe to date.",07/11/2022,U.S.
198,2022,22-Jul,Chinese paddlefish declared extinct.,07/22/2022,China
199,2022,4-Aug,China conducts its largest ever military exercise around Taiwan in response to a controversial visit by Nancy Pelosi.,08/04/2022,"China,Taiwan"
200,2022,24-Aug,"""Man of the Hole"", reclusive indigenous Brazilian and last of his ethnicity, dies.",08/24/2022,Brazil
201,2022,28-Aug,Floods in Pakistan trigger an economic crisis.,08/28/2022,Pakistan
202,2022,31-Aug,UN Human Rights Office report on Xinjiang is released.,08/31/2022,
203,2022,8-Sep,"Elizabeth II dies at the age of 96, and is succeeded by Charles III.",09/08/2022,
204,2022,16-Sep,Mahsa Amini protests.,09/16/2022,
205,2022,25-Sep,Eliud Kipchoge sets marathon world record at the 2022 Berlin Marathon.,09/25/2022,
206,2022,26-Sep,Double Asteroid Redirection Test demonstrates capabilities on asteroid (65803) Didymos I Dimorphos.,09/26/2022,
207,2022,September 27 – 30,"Hurricane Ian impacts Cuba and the US, causing catastrophic damage to both nations, killing at least 157 people, 16 missing, and leaving millions without power, including the entirety of Cuba.",,
208,2022,1-Oct,"A fatal human crush occurs during an association football match at Kanjuruhan Stadium in Malang Regency, East Java, Indonesia, killing 131 people and injuring more than 500.",10/01/2022,
209,2022,6-Oct,"36 people are killed in a shooting, stabbing, and vehicle-ramming at Nong Bua Lamphu, Thailand.",10/06/2022,
210,2022,2-Nov,Ethiopia–Tigray peace agreement.,11/02/2022,
211,2022,11-Nov,The FTX cryptocurrency exchange files for Chapter 11 bankruptcy.,11/11/2022,
212,2022,15-Nov,The world population is estimated to have reached 8 billion.,11/15/2022,
213,2022,16-Nov,"NASA launches Artemis 1, the first uncrewed mission of its Space Launch System, the most powerful rocket ever to reach orbit.",11/16/2022,
214,2022,26-Nov,COVID-19 protests in China.,11/26/2022,
215,2022,30-Nov,"OpenAI launches ChatGPT, an AI chatbot.",11/30/2022,
216,2022,7-Dec,"Self-coup attempt, impeachment and arrest of President Pedro Castillo sparks protests in Peru.",12/07/2022,
217,2022,9-Dec,Qatar corruption scandal at the European Parliament.,12/09/2022,
218,2023,January – October,2023 Israeli judicial reform protests.,,
219,2023,8-Jan,2023 Brazilian Congress attack.,01/08/2023,
220,2023,19-Jan,2023 French pension reform strikes.,01/19/2023,
221,2023,6-Feb,"2023 Turkey-Syria earthquakes kill nearly 60,000 people.",02/06/2023,
222,2023,21-Feb,"Cyclone Freddy kills 1,400 in Malawi and Mozambique.",02/21/2023,
223,2023,10-Mar,Iran and Saudi Arabia restore diplomatic relations.,03/10/2023,
224,2023,4-Apr,Finland joins NATO.,04/04/2023,
225,2023,13-Apr,R21/Matrix-M malaria vaccine approved for use.,04/13/2023,
226,2023,15-Apr,War in Sudan.,04/15/2023,
227,2023,20-Apr,"SpaceX conducts the first full stack test launch of the world's most powerful rocket, Starship.",04/20/2023,
228,2023,5-May,World Health Organization ends the designation of COVID-19 as a public health emergency of international concern.,05/05/2023,
229,2023,6-May,Charles III is crowned king of the United Kingdom and Commonwealth realms.,05/06/2023,
230,2023,17-May,2023 Ecuadorian political crisis.,05/17/2023,
231,2023,2-Jun,2023 Odisha train collision.,06/02/2023,
232,2023,12-Jun,Kwara boat disaster.,06/12/2023,
233,2023,14-Jul,2023 SAG-AFTRA strike.,07/14/2023,
234,2023,26-Jul,2023 Nigerien coup d'état.,07/26/2023,
235,2023,23-Aug,ISRO's Chandrayaan 3 lands on the lunar south pole making India the 4th nation to successfully soft land on the Moon.,08/23/2023,
236,2023,30-Aug,2023 Gabonese coup d'état.,08/30/2023,
237,2023,8-Sep,2023 Marrakesh-Safi earthquake kills nearly 6000 people.,09/08/2023,
238,2023,10-Sep,"Storm Daniel becomes the deadiest Mediterranean storm in history, with over 4000 deaths in Libya.",09/10/2023,
239,2023,September 19 – 20,2023 Azerbaijani offensive in Nagorno-Karabakh.,,
240,2023,3-Oct,Kevin McCarthy's expulsion via a motion introduced by Matt Gaetz is the first ousting of a Speaker of the United States House of Representatives in history.,10/03/2023,
241,2023,7-Oct,Hamas attacks Israel; start of the Israel-Hamas war.,10/07/2023,
242,2023,7-Oct,2023 Herat earthquakes.,10/07/2023,
243,2023,23-Oct,2023 Guayana Esequiba crisis.,10/23/2023,
244,2023,27-Oct,"Operation 1027, a coordinated assault by anti-Junta forces in the Myanmar civil war, begins.",10/27/2023,
245,2023,24-Nov,Somalia admitted to East African Community.,11/24/2023,
246,2023,12-Dec,COP28 ends with world leaders pledging transition away from fossil fuels.,12/12/2023,
247,2023,18-Dec,Catholic Church releases Fiducia supplicans.,12/18/2023,
248,2023,31-Dec,Queen Margrethe II of Denmark announces her abdication on January 14 after 52 years on the throne.,12/31/2023,
